"Name","State","Status","Started","StartMode","StartName","ProcessID","ProcessName","PathName","Caption","Description","DelayedAutoStart","AcceptPause","AcceptStop","PSComputerName","RunspaceId","PSShowComputerName"
"WinRM","Running","OK","True","Auto","NT AUTHORITY\NetworkService","928","svchost","C:\Windows\System32\svchost.exe -k NetworkService","Windows Remote Management (WS-Management)","Windows Remote Management (WinRM) service implements the WS-Management protocol for remote management. WS-Management is a standard web services protocol used for remote software and hardware management. The WinRM service listens on the network for WS-Management requests and processes them. The WinRM Service needs to be configured with a listener using winrm.cmd command line tool or through Group Policy in order for it to listen over the network. The WinRM service provides access to WMI data and enables event collection. Event collection and subscription to events require that the service is running. WinRM messages use HTTP and HTTPS as transports. The WinRM service does not depend on IIS but is preconfigured to share a port with IIS on the same machine.  The WinRM service reserves the /wsman URL prefix. To prevent conflicts with IIS, administrators should ensure that any websites hosted on IIS do not use the /wsman URL prefix.",,"False","True","MEGATRON","7368b46c-47d4-4759-bea4-8800a5ec7225","True"
"WlanSvc","Running","OK","True","Auto","LocalSystem","668","svchost","C:\Windows\system32\svchost.exe -k WlansvcGroup","WLAN AutoConfig","The WLANSVC service provides the logic required to configure, discover, connect to, and disconnect from a wireless local area network (WLAN) as defined by IEEE 802.11 standards. It also contains the logic to turn your computer into a software access point so that other devices or computers can connect to your computer wirelessly using a WLAN adapter that can support this. Stopping or disabling the WLANSVC service will make all WLAN adapters on your computer inaccessible from the Windows networking UI. It is strongly recommended that you have the WLANSVC service running if your computer has a WLAN adapter.",,"False","True","MEGATRON","7368b46c-47d4-4759-bea4-8800a5ec7225","True"
"wmiApSrv","Stopped","OK","False","Manual","localSystem","0","Idle","C:\Windows\system32\wbem\WmiApSrv.exe","WMI Performance Adapter","Provides performance library information from Windows Management Instrumentation (WMI) providers to clients on the network. This service only runs when Performance Data Helper is activated.",,"False","False","MEGATRON","7368b46c-47d4-4759-bea4-8800a5ec7225","True"
"WPDBusEnum","Stopped","OK","False","Manual","LocalSystem","0","Idle","C:\Windows\system32\svchost.exe -k LocalSystemNetworkRestricted","Portable Device Enumerator Service","Enforces group policy for removable mass-storage devices. Enables applications such as Windows Media Player and Image Import Wizard to transfer and synchronize content using removable mass-storage devices.",,"False","False","MEGATRON","7368b46c-47d4-4759-bea4-8800a5ec7225","True"
"WSearch","Running","OK","True","Auto","LocalSystem","2416","SearchIndexer","C:\Windows\system32\SearchIndexer.exe /Embedding","Windows Search","Provides content indexing, property caching, and search results for files, e-mail, and other content.",,"False","True","MEGATRON","7368b46c-47d4-4759-bea4-8800a5ec7225","True"
"WSService","Stopped","OK","False","Manual","LocalSystem","0","Idle","C:\Windows\System32\svchost.exe -k wsappx","Windows Store Service (WSService)","Provides infrastructure support for Windows Store.This service is started on demand and if disabled applications bought using Windows Store will not behave correctly.",,"False","False","MEGATRON","7368b46c-47d4-4759-bea4-8800a5ec7225","True"
"wuauserv","Stopped","OK","False","Manual","LocalSystem","0","Idle","C:\Windows\system32\svchost.exe -k netsvcs","Windows Update","Enables the detection, download, and installation of updates for Windows and other programs. If this service is disabled, users of this computer will not be able to use Windows Update or its automatic updating feature, and programs will not be able to use the Windows Update Agent (WUA) API.",,"False","False","MEGATRON","7368b46c-47d4-4759-bea4-8800a5ec7225","True"
"wudfsvc","Running","OK","True","Manual","LocalSystem","384","svchost","C:\Windows\system32\svchost.exe -k LocalSystemNetworkRestricted","Windows Driver Foundation - User-mode Driver Framework","Creates and manages user-mode driver processes. This service cannot be stopped.",,"False","False","MEGATRON","7368b46c-47d4-4759-bea4-8800a5ec7225","True"
